property_address,apn_public_or_inferred,event_date,public_sale_price,public_sources,source_urls,recorder_document_number,recorder_document_type,recorder_recording_date,recorder_grantors,recorder_grantees,recorder_transfer_tax_amount,recorder_tax_estimated_consideration,price_match_status,pull_instruction,legal_use_boundary
"16251 Waikiki Ln, Huntington Beach, CA 92649",17808315 / 178-083-15,2024-11-06,1177500,Redfin; Zillow,https://www.redfin.com/CA/Huntington-Beach/16251-Waikiki-Ln-92649/home/3868041 | https://www.zillow.com/homedetails/16251-Waikiki-Ln-Huntington-Beach-CA-92649/25298849_zpid/,2024000290531,GRANT DEED,11/6/2024,BARTMAN GREGORY GEORGE TR,REDMOND ROBERT,1295.25,1177500.0,exact_public_price_match,"Pull certified/official copy; extract grantor, grantee, APN, legal description, vesting, transfer-tax declaration, title/escrow/preparer, notary, and any exclusions.",Known index target. Do not draft quitclaim/corrective demand until current title and full prior chain are confirmed.
"16251 Waikiki Ln, Huntington Beach, CA 92649",17808315 / 178-083-15,2005-12-02,729000,Zillow listing/public sale history,https://www.zillow.com/homedetails/16251-Waikiki-Ln-Huntington-Beach-CA-92649/25298849_zpid/,,,,,,,,public_history_only,"Run RecorderWorks/official chain search by APN/address/date/price; pull deed, trust deed, reconveyance, assignments, substitutions, and title-company companion documents around this sale date.",Public listing history only. Do not infer parties or void-transfer origin until official chain documents identify grantor/grantee and legal description.
"16251 Waikiki Ln, Huntington Beach, CA 92649",17808315 / 178-083-15,2003-09-03,483000,Zillow listing/public sale history,https://www.zillow.com/homedetails/16251-Waikiki-Ln-Huntington-Beach-CA-92649/25298849_zpid/,,,,,,,,public_history_only,"Run RecorderWorks/official chain search by APN/address/date/price; pull deed, trust deed, reconveyance, assignments, substitutions, and title-company companion documents around this sale date.",Public listing history only. Do not infer parties or void-transfer origin until official chain documents identify grantor/grantee and legal description.
"16251 Waikiki Ln, Huntington Beach, CA 92649",17808315 / 178-083-15,1994-03-15,206000,Zillow listing/public sale history,https://www.zillow.com/homedetails/16251-Waikiki-Ln-Huntington-Beach-CA-92649/25298849_zpid/,,,,,,,,public_history_only,"Run RecorderWorks/official chain search by APN/address/date/price; pull deed, trust deed, reconveyance, assignments, substitutions, and title-company companion documents around this sale date.",Public listing history only. Do not infer parties or void-transfer origin until official chain documents identify grantor/grantee and legal description.
"16251 Waikiki Ln, Huntington Beach, CA 92649",17808315 / 178-083-15,2024-11-06,,RecorderWorks companion-document inference,,2024000290532,TRUST DEED,11/6/2024,REDMOND ROBERT,MERS / V I P INDEPENDENT MORTGAGE,,,same_day_financing_companion_needs_image_confirmation,"Pull official/certified image as same-day financing companion to 2024000290531; extract lender, trustee, legal description, APN, notary, escrow/title, and loan amount if present.",Use only as companion-chain context until the official image confirms it encumbers the same parcel.
